{
	"simulation": {
		"engine": "MMCACovid19",
		"start_date": "2020-02-09",
		"end_date": "2021-02-08",
		"save_full_output": true,
		"save_observables": true,
		"save_time_step": -1,
		"input_format": "csv",
		"output_folder": "output",
		"output_format": "netcdf"
	},
	"data": {
		"initial_condition_filename": "A0_initial_conditions_seeds.csv",
		"metapopulation_data_filename": "metapopulation_data.csv",
		"mobility_matrix_filename": "R_mobility_matrix.csv",
		"kappa0_filename": "kappa0_from_mitma.csv"
	},
	"epidemic_params": {
		"scale_β": 0.51,
		"βᴬ": 0.046053,
		"βᴵ": 0.0903,
		"ηᵍ": [0.2747252747252747, 0.2747252747252747, 0.2747252747252747],
		"αᵍ": [0.26595744680851063, 0.641025641025641, 0.641025641025641],
		"μᵍ": [1.0, 0.3125, 0.3125],
		"θᵍ": [0.0, 0.0, 0.0],
		"γᵍ": [0.003, 0.01, 0.08],
		"ζᵍ": [0.12820512820512822, 0.12820512820512822, 0.12820512820512822],
		"λᵍ": [1.0, 1.0, 1.0],
		"ωᵍ": [0.0, 0.04, 0.3],
		"ψᵍ": [0.14285714285714285, 0.14285714285714285, 0.14285714285714285],
		"χᵍ": [0.047619047619047616, 0.047619047619047616, 0.047619047619047616]
	},
	"population_params": {
		"G_labels": ["Y", "M", "O"],
		"C": [
				[ 0.598,  0.38486, 0.01714],
				[ 0.244,  0.721,   0.0353],
				[ 0.1919, 0.5705,  0.2376]
			],
		"kᵍ": [11.8, 13.3, 6.76],
		"kᵍ_h": [3.15, 3.17, 3.28],
		"kᵍ_w": [1.72, 5.18, 0.0],
		"pᵍ": [0.0, 1.0, 0.0],
		"ξ": 0.01,
		"σ": 2.5
	},
	"NPI":{
		"κ₀s": [0.8],
		"ϕs":  [0.2],
		"δs":  [0.8],
		"tᶜs": [100],
		"are_there_npi": true
	}
}
