{
	"simulation": {
		"engine": "MMCACovid19",
		"start_date": "2020-02-09",
		"end_date": "2020-05-31",
		"save_full_output": true,
		"save_observables": true,
		"save_time_step": -1,
		"input_format": "csv",
		"output_folder": "output",
		"output_format": "netcdf"
	},
	"data": {
		"initial_condition_filename": "A0_initial_conditions_seeds.csv",
		"metapopulation_data_filename": "metapopulation_data.csv",
		"mobility_matrix_filename": "R_mobility_matrix.csv",
		"kappa0_filename": "kappa0.csv"
	},
	"epidemic_params": {
		"scale_\u03b2": 0.51,
		"\u03b2\u1d2c": 0.046053,
		"\u03b2\u1d35": 0.0903,
		"\u03b7\u1d4d": [
			0.2747252747252747,
			0.2747252747252747,
			0.2747252747252747
		],
		"\u03b1\u1d4d": [
			0.26595744680851063,
			0.641025641025641,
			0.641025641025641
		],
		"\u03bc\u1d4d": [
			1.0,
			0.3125,
			0.3125
		],
		"\u03b8\u1d4d": [
			0.0,
			0.0,
			0.0
		],
		"\u03b3\u1d4d": [
			0.003,
			0.01,
			0.08
		],
		"\u03b6\u1d4d": [
			0.12820512820512822,
			0.12820512820512822,
			0.12820512820512822
		],
		"\u03bb\u1d4d": [
			1.0,
			1.0,
			1.0
		],
		"\u03c9\u1d4d": [
			0.0,
			0.04,
			0.3
		],
		"\u03c8\u1d4d": [
			0.14285714285714285,
			0.14285714285714285,
			0.14285714285714285
		],
		"\u03c7\u1d4d": [
			0.047619047619047616,
			0.047619047619047616,
			0.047619047619047616
		]
	},
	"population_params": {
		"G_labels": [
			"Y",
			"M",
			"O"
		],
		"C": [
			[
				0.598,
				0.38486,
				0.01714
			],
			[
				0.244,
				0.721,
				0.0353
			],
			[
				0.1919,
				0.5705,
				0.2376
			]
		],
		"k\u1d4d": [
			11.8,
			13.3,
			6.76
		],
		"k\u1d4d_h": [
			3.15,
			3.17,
			3.28
		],
		"k\u1d4d_w": [
			1.72,
			5.18,
			0.0
		],
		"p\u1d4d": [
			0.0,
			1.0,
			0.0
		],
		"\u03be": 0.01,
		"\u03c3": 2.5
	},
	"NPI": {
		"\u03ba\u2080s": [
			0.8
		],
		"\u03d5s": [
			0.2
		],
		"\u03b4s": [
			0.8
		],
		"t\u1d9cs": [
			100
		],
		"are_there_npi": true
	}
}